{
  "schemaVersion": 1,
  "tier": "T3",
  "issue": 53,
  "riskTriggers": [
    "persistent-project-shape",
    "shared-audio-renderer-semantics",
    "cross-runtime-audio-window"
  ],
  "dependsOn": [
    "20260911-111000-creative-loop",
    "20260911-143500-persistence-trust",
    "20260912-175400-export-trust"
  ]
}
