{
  "schemaVersion": 1,
  "tier": "T2",
  "issue": 51,
  "riskTriggers": [
    "public-web-entry",
    "release-positioning",
    "browser-capability-matrix",
    "release-verification"
  ],
  "dependsOn": [
    "20260911-111000-creative-loop",
    "20260911-143500-persistence-trust",
    "20260912-175400-export-trust",
    "20260913-115000-first-run-launch-e2e"
  ]
}
